date,username,to,replies,retweets,favorites,text,geo,mentions,hashtags,id,permalink
2019-09-11 23:39:10,AhoLord,,0,0,0,"like hahaha bro it was really funny when you posted an image of a brown m&m on bernie sanders tweet about renewable energy hahahaha im following you brudda",,,,1171931219610628096,https://twitter.com/AhoLord/status/1171931219610628096
2019-09-11 23:38:42,Mo31069729Frank,,0,0,0,"Bernie Sanders at the Islamic Society of North America (Part 2) https://www.jihadwatch.org/2019/09/bernie-sanders-at-the-islamic-society-of-north-america-part-2 …",,,,1171931100500779008,https://twitter.com/Mo31069729Frank/status/1171931100500779008
2019-09-11 23:38:39,JeanRxTech,jeffchao228,0,0,0,"None of my Sanders friends are abandoning Bernie, but I see many who supported Hillary are now going for Warren.",,,,1171931089365020673,https://twitter.com/JeanRxTech/status/1171931089365020673
2019-09-11 23:38:13,billm9,,0,0,0,"'I love Bernie, but': Electability worries haunt Sanders. Imagination/ bullshit. We’ve been waiting. Wait no more https://www.politico.com/story/2019/09/11/sanders-voters-electable-2020-1489146 …",,,,1171930978660601857,https://twitter.com/billm9/status/1171930978660601857
2019-09-11 23:38:11,Wilson04425121,HumanistReport,0,0,1,"Blacks don’t like Bernie is the biggest takeaway from this. Obviously we already know about the media bias against Sanders",,,,1171930970733387777,https://twitter.com/Wilson04425121/status/1171930970733387777
2019-09-11 23:37:51,Petemode,Rhye88,2,0,0,"A lot will change with Warren. The fact that people can say anybody that is not Bernie Sanders is the same as Trump is absolutely asinine.",,,,1171930888025837568,https://twitter.com/Petemode/status/1171930888025837568
2019-09-11 23:37:51,MicWalsh1,,2,9,10,"Calling on all progressives to unite behind Senator Sanders. It is time to stand up and be counted. We can do this. Bernie is on a roll and there is no doubt Warren meeting with HRC has sealed her fate #Bernie2020 #Sanders2020 #BernieSanders #BernieBeatsTrump #NoMiddleGround",,,#Bernie2020 #Sanders2020 #BernieSanders #BernieBeatsTrump #NoMiddleGround,1171930887472254976,https://twitter.com/MicWalsh1/status/1171930887472254976
2019-09-11 23:37:25,ThrashDrag,ThrashDrag,0,0,1,"Then, on top of that, you have similar comments made about Bernies integrity by Robert Reich. Someone seen as more trustworthy than the likes of Bob Ney, corroborats the character of Bernie Sanders by a previously convicted corrupted politian. It gives the statement more weight.",,,,1171930777879232512,https://twitter.com/ThrashDrag/status/1171930777879232512
2019-09-11 23:37:12,HangrySkywalker,,0,0,1,"The teardown won't happen until Bernie is out or they can reel Warren in. Wall St would rather have Trump than Sanders, so take him out in the primary. They want something you can control Sanders hasn't shown comprise. Warren has backed down before #tytlive",,,#tytlive,1171930721650388993,https://twitter.com/HangrySkywalker/status/1171930721650388993
2019-09-11 23:36:49,Jantxnc,,0,0,0,"REALLY?! Bernie Sanders ends 9/11 thread by hoping to see US power ‘measured not by our ability to blow things up’ (and people have thoughts) – http://twitchy.com https://twitchy.com/dougp-3137/2019/09/11/really-bernie-sanders-ends-9-11-thread-by-hoping-to-see-us-power-measured-not-by-our-ability-to-blow-things-up-and-people-have-thoughts/ …",,,,1171930625999286272,https://twitter.com/Jantxnc/status/1171930625999286272
2019-09-11 23:36:18,mslysistrata,,0,0,0,"Why Bernie Sanders won't brush his hair https://www.aljazeera.com/blogs/americas/2015/11/bernie-sanders-won-brush-hair-151119182829693.html …",,,,1171930497905299456,https://twitter.com/mslysistrata/status/1171930497905299456
2019-09-11 23:36:15,apignataro,,0,2,5,"Chapman University Professor Peter McLaren really likes Bernie Sanders’ plan for public education. And he has a ton to say about it. Via @OCWeeklyhttps://ocweekly.com/chapman-professor-backs-bernie-sanders-public-education-plan/ …",,@OCWeeklyhttps,,1171930484810534912,https://twitter.com/apignataro/status/1171930484810534912
2019-09-11 23:36:12,bfrye51,,0,0,0,"Krystal Ball: What if Bernie Sanders won Texas? https://youtu.be/bHm3a6JLmaQ via @YouTube",,@YouTube,,1171930471044931584,https://twitter.com/bfrye51/status/1171930471044931584
2019-09-11 23:35:40,GabeLight,nicolesandler,2,0,18,"Nooooo it’s not an attack to point out something she said. We need to do better. She stated several times “access” to healthcare as her rhetoric, several times. You’re right to ask the question and I want an answer. You know who we don’t have to push? Bernie Sanders",,,,1171930336948678657,https://twitter.com/GabeLight/status/1171930336948678657
2019-09-11 23:35:03,Nixxed,YangRevolution,1,0,1,"Don't call them Bernie Bros. You only entrench them further. I understand your point though. They are entrenched Sanders supporters who go out of their way to spread misinformation. Try not to disparage them directly. We can win them over. Very slowly. Kill 'em with kindness.",,,,1171930184028737536,https://twitter.com/Nixxed/status/1171930184028737536
2019-09-11 23:34:51,LilLubbie,BernieSanders,0,0,0,"Bernie Sanders- The Jewish Anti-Semite!!!!",,,,1171930133353193473,https://twitter.com/LilLubbie/status/1171930133353193473
2019-09-11 23:34:51,IWiIlkaga,animal_lover365,1,0,0,"He’s beliefs on foreign policy, unfortunately imo being a Bush Republican, are progressive/libertarian, so, if he hires someone that Rand Paul or Bernie Sanders would like, the GOP would be pissed. There are no qualified “populists/nationalists” to hire for top positions...",,,,1171930132208148482,https://twitter.com/IWiIlkaga/status/1171930132208148482
2019-09-11 23:34:44,m_mendozaferrer,m_mendozaferrer,0,6,11,"Hey @PeterWelch - do you have any comment on Bernie Sanders quoting Peter Freyne's piece to smear his moderate Republican female opponent Susan Sweetser (a rape victim and victim rights' activist - as ""too brassy. too bitchy. too-loud"" in his 1997 memoir? #BlameTheVictimhttps://twitter.com/m_mendozaferrer/status/1170573875329077248 …",,@PeterWelch,#BlameTheVictimhttps,1171930102495621121,https://twitter.com/m_mendozaferrer/status/1171930102495621121
2019-09-11 23:34:22,IStandWithIlhan,IStandWithIlhan,1,0,2,"before 2016, used to think most of the liberal democrats would endorse a Sanders type candidate if one were viable. nope. We suddenly had people i've always admired from Gloria Steinem to Dolores Huerta were virulently anti-Bernie.",,,,1171930009746968577,https://twitter.com/IStandWithIlhan/status/1171930009746968577
2019-09-11 23:33:05,RCAstudios,,5,0,0,"These ""Bernie or Bust"" folks are pathetic. While Sanders is clearly the most progressive candidate, Warren is also a great choice. Open you mind just a little. If you care about your country you'll cast a ballot for the Democrats in 2020. Put aside your privilidge dammit!",,,,1171929687246999554,https://twitter.com/RCAstudios/status/1171929687246999554
2019-09-11 23:31:49,DavidKaraian,TorresAren,0,8,8,"Socialismo del Siglo 21! Para todos los Socialistas! Michelle Bachelet Federica Mog. AMLO EVO Morales H.R.Allup M.Dias Canel Diego Inhalando Maladroga Eve de Bonafides Cristina Kirschner Bernie Sanders Alexandra Ocasio Cortez Julio Borges Por Dios!!! https://twitter.com/torresaren/status/1171919014928551937?s=12 …",,,,1171929367154442240,https://twitter.com/DavidKaraian/status/1171929367154442240
