date,username,to,replies,retweets,favorites,text,geo,mentions,hashtags,id,permalink
2019-10-07 23:59:31,CHANNAKAJIMA,,0,0,0,"Billionaire CEOs Whine on Fox News About Bernie Sanders’ Wealth Tax https://youtu.be/Do7I6ylWMc0 via @YouTube",,@YouTube,,1181358425277652993,https://twitter.com/CHANNAKAJIMA/status/1181358425277652993
2019-10-07 23:58:53,AarickStriger,AarickStriger,5,49,164,"The Antifa web zine Its Going Down is calling on its twitter for supporters to go protest to KEEP the illegal US military presence in Syria, LOL. Huckster Bernie Sanders and warmonger Lindsey Graham are together selling Israeli foreign policy interests to different crowds https://twitter.com/AarickStriger/status/1181352278504161283 …",,,,1181358263310389250,https://twitter.com/AarickStriger/status/1181358263310389250
2019-10-07 23:58:48,MaggottyBread,,0,1,1,"Brilliant Bernie Sanders Ad Exposes Gross Media Bias https://youtu.be/ApGHzpGgSN8 via @YouTube #MSM #CorporateMedia #MSNBC #CNN #FoxNews #FactsMatter #FactCheck #Sanders2020",,@YouTube,#MSM #CorporateMedia #MSNBC #CNN #FoxNews #FactsMatter #FactCheck #Sanders2020,1181358244310204417,https://twitter.com/MaggottyBread/status/1181358244310204417
2019-10-07 23:58:48,ddayen,bailey_melvin,0,0,15,"There are 330 million people in the country and it's news that 1 million of them donated to some old dude named Bernie Sanders?",,,,1181358241617334277,https://twitter.com/ddayen/status/1181358241617334277
2019-10-07 23:58:37,siegelsnest5858,jakemiller85,0,0,0,"Venezuela is a totally socialist government now and it’s a much smaller country. Bernie Sanders could never have the power that they allowed in Venezuela. There would be civil unrest. Bernie simply wants to add more socialist policies to our mixed economy.",,,,1181358196872617984,https://twitter.com/siegelsnest5858/status/1181358196872617984
2019-10-07 23:58:25,CritLeft,CritLeft,0,0,1,"It's not like the NDP is really all that radical to begin with. It's not like we got a Bernie Sanders or Jeremy Corbyn sort of situation over here in Canada. People will vote, but they're not THAT thrilled to vote. They're not feeling the Bern or anything comparable.",,,,1181358148189376512,https://twitter.com/CritLeft/status/1181358148189376512
2019-10-07 23:58:20,GeminiWahhaj,peterdaou,1,5,7,".It should now be obvious, almost beyond dispute, that the Democrats should have nominated Bernie Sanders in 2016. During the primary, he polled better in match-ups against Donald Trump than Hillary Clinton did. https://www.currentaffairs.org/2018/06/there-is-still-only-one-clear-way-to-get-rid-of-trump …",,,,1181358125804335104,https://twitter.com/GeminiWahhaj/status/1181358125804335104
2019-10-07 23:58:11,NeilPConnor1,BernieSanders,0,1,1,"Bernie Sanders announces he's dropping out of the 2020 US election. https://twitter.com/BernieSanders/status/1180891570419240960 …",,,,1181358087619383297,https://twitter.com/NeilPConnor1/status/1181358087619383297
2019-10-07 23:58:09,VikingInFL,,0,0,0,"Billionaire Vows to Move to Australia if Bernie Sanders is Elected https://youtu.be/vpv_FivrkLw via @YouTube",,@YouTube,,1181358081550290945,https://twitter.com/VikingInFL/status/1181358081550290945
2019-10-07 23:57:56,ampiper420,,0,0,0,"Bernie Sanders Has Stuck To The Same Message For 40 Years https://www.npr.org/2015/12/11/459231940/bernie-sanders-has-stuck-to-the-same-message-for-40-years?fbclid=IwAR1BY01PDK7upf2t67ogJXCU7lawl4EE0GgEQddZViDHC-4JjkFPU5u4wVs …",,,,1181358027556950016,https://twitter.com/ampiper420/status/1181358027556950016
2019-10-07 23:57:47,Betamalez,Betamalez,0,0,0,"Tempted to delete this and but Bernie sanders https://twitter.com/Betamalez/status/1181352881347334145 …",,,,1181357987794956288,https://twitter.com/Betamalez/status/1181357987794956288
2019-10-07 23:57:45,amberllab,,0,0,0,"Justin Trudeau 47 Jagmeet Singh 40 Andrew Scheer 40 Elizabeth May 65 Average age: 48 years Donald Trump 73 Joe Biden 76 Elizabeth Warren 70 Bernie Sanders 78 Pete Buttigieg 37 Average age: 66.8 years - Older isn't better! #leadersdebate2019 #Debatenight #elx43 #NDP",,,#leadersdebate2019 #Debatenight #elx43 #NDP,1181357981323206656,https://twitter.com/amberllab/status/1181357981323206656
2019-10-07 23:57:41,Zer0Books,,0,2,5,"“Elizabeth Warren vs. Bernie Sanders | Noah Smith & Ben Burgis” https://buff.ly/2ASsvZi",,,,1181357964587864064,https://twitter.com/Zer0Books/status/1181357964587864064
2019-10-07 23:57:37,MannyMolina24,SupGirl,0,0,1,"Damn girl...that got me. I support Sen Sanders!",,,,1181357944832757760,https://twitter.com/MannyMolina24/status/1181357944832757760
2019-10-07 23:57:28,adpikelly,SteveSebelius,0,0,2,"I'm not gonna lie, I Mayor Pete! This is definitely a great ad! Its like the time the bird landed on the podium at a Bernie Sanders rally last election cycle. Just a moment of real life in this insane campaign season. https://twitter.com/SteveSebelius/status/1181352073662586880 …",,,,1181357906542743553,https://twitter.com/adpikelly/status/1181357906542743553
2019-10-07 23:57:00,bloggingheads,,2,2,5,"Is free college a good idea? @Noahpinion and @BenBurgis debate the pros and cons of Bernie Sanders's proposal for free tuition at all public universities. https://buff.ly/2Ouxaso",,@Noahpinion @BenBurgis,,1181357790306148352,https://twitter.com/bloggingheads/status/1181357790306148352
2019-10-07 23:56:53,WNLaws,Embroiderista,2,0,4,"Every campaign has thse ppl who ridiculous. Every single 1. It sucks when these outliers taint the rest of us. The majority of Sanders suprtrs r concerned w policy & change, not browbeating & name calling. Smtimes w social media we can 4get its not an accurate representation.",,,,1181357762980274176,https://twitter.com/WNLaws/status/1181357762980274176
2019-10-07 23:56:16,jcgilley1,CRDAnalytics,0,0,1,"I know there are a lot of factors that make discounting Sanders at this point seem plausible, but looking at his numbers suggests he could easily have surprising numbers at the polls. As Yang has a grassroots campaign, Bernie's does too, but quite larger, if not as vocal",,,,1181357606897688576,https://twitter.com/jcgilley1/status/1181357606897688576
2019-10-07 23:56:12,KaivanShroff,,94,1046,4233,"Hillary Clinton attended a 9/11 ceremony with pneumonia & it was in the news for WEEKS. Bernie concealed his heart attack and get 1-2 stories total. That’s the sexist double-standard we were calling out in 2016. And I hope Senator Sanders is doing well, so don’t even go there.",,,,1181357588786696193,https://twitter.com/KaivanShroff/status/1181357588786696193
2019-10-07 23:56:07,ThePolicyBot,,0,0,0,"Bernie Sanders Annonuces Lunar Rocks Are Gay Somehow",,,,1181357566871384064,https://twitter.com/ThePolicyBot/status/1181357566871384064
2019-10-07 23:55:40,ProgressDude,,1,3,5,"Why does @BernieSanders @SenSanders have to win? The reasons are many. All #BernieSanders #Bernie2020 supporters need to read this - and SHARE IT! Share it OFTEN!https://www.currentaffairs.org/2019/10/why-bernie-has-to-win …",,@BernieSanders @SenSanders,#BernieSanders #Bernie2020,1181357453155426305,https://twitter.com/ProgressDude/status/1181357453155426305
2019-10-07 23:55:32,Sker4Lyfe,VeeCeeMurphy76,2,0,3,"Silly me I thought ""mandate of heaven"" meant they were talking about Bernie Sanders",,,,1181357422805434369,https://twitter.com/Sker4Lyfe/status/1181357422805434369
2019-10-07 23:55:30,kajarajA81,,0,0,0,"#tytlive spend less 20 mins on Bernie Sanders new policy, good job @cenkuygur , u have lot time trump",,@cenkuygur,#tytlive,1181357414106501120,https://twitter.com/kajarajA81/status/1181357414106501120
2019-10-07 23:55:29,pennyindenver,ThirdWayTweet,0,0,0,"The only one who can do that is Bernie Sanders. He’s reached out to independents and Republicans. It’s just the centrist Dems who are the hold outs.",,,,1181357410390179840,https://twitter.com/pennyindenver/status/1181357410390179840
2019-10-07 23:54:34,brown60076,peterdaou,1,0,3,"The DNC has little intensity or determination except for putting down Bernie Sanders",,,,1181357178743148544,https://twitter.com/brown60076/status/1181357178743148544
2019-10-07 23:54:25,ChachiButt,CNNPolitics,0,0,0,"Ofcourse Bernie Sanders' heart attack matters ,he's not fit to be president. A president must be in good health to run our country,and he's not.",,,,1181357138611970048,https://twitter.com/ChachiButt/status/1181357138611970048
2019-10-07 23:53:58,prairieguy61,daltonnyuphilo1,0,0,4,"A rightwing hack with a national platform picks up “research” done by Bernie cultists. Tell me again how Bernie Sanders isn’t first and foremost a Republican enabler?",,,,1181357028452773896,https://twitter.com/prairieguy61/status/1181357028452773896
2019-10-07 23:53:06,GlennGolf4211,,0,0,0,"MSNBC Ordered Ed Schultz Not To Cover Bernie Sanders, Then Fired Him https://youtu.be/-0w_8spt-6c via @YouTube",,@YouTube,,1181356810738888704,https://twitter.com/GlennGolf4211/status/1181356810738888704
2019-10-07 23:52:35,WolfeNotes,,0,0,0,"The NYT has hit rock bottom: under the by-line of an MD (not hitwoman reporter Sydney Ember), they highlight a quote from Reaganite Ed Rollins. DISGUSTING! How Will Bernie Sanders’s Heart Attack Affect His Campaign? https://nyti.ms/2LSOOVa",,,,1181356680832962560,https://twitter.com/WolfeNotes/status/1181356680832962560
2019-10-07 23:52:27,OsrTheGreat,,1,3,7,"The fact that Bernie Sanders is considered a radical by some people is hilarious. His policies are weak as hell compared to what should actually be done. He isn't really a socialist, he's capitalism's safety boat. But capitalists are too stupid to realize this.",,,,1181356644032274432,https://twitter.com/OsrTheGreat/status/1181356644032274432
2019-10-07 23:52:24,SandyQuinn1,,1,5,18,"Thank you, President Trump! Who dares trade this for Bernie Sanders, Elizabeth Warren or Sleepy Joe? Let’s keep America great! pic.twitter.com/5BvJsSasAq",,,,1181356632925601792,https://twitter.com/SandyQuinn1/status/1181356632925601792
2019-10-07 23:52:22,ttunshell,BernieSanders,0,0,0,"He's much more of a constitutionalists than you are Mr Sanders...",,,,1181356623505367040,https://twitter.com/ttunshell/status/1181356623505367040
2019-10-07 23:52:17,UltraVerified,,2,0,0,"NPR political experts desperately trying to minimize Bernie Sanders.",,,,1181356604815499264,https://twitter.com/UltraVerified/status/1181356604815499264
2019-10-07 23:52:15,master_deli,scottwill42,0,0,2,"I'd never vote for Bernie Sanders, so you might as well block me, too. I hate cultists.",,,,1181356595676155905,https://twitter.com/master_deli/status/1181356595676155905
2019-10-07 23:51:53,liberalforeverX,,0,1,3,"Brilliant Bernie Sanders Ad Exposes Gross Media Bias https://youtu.be/ApGHzpGgSN8 via @YouTube",,@YouTube,,1181356502361296896,https://twitter.com/liberalforeverX/status/1181356502361296896
2019-10-07 23:51:39,Howdyhorde,Corvaire_Wind,1,4,9,"https://www.youtube.com/watch?v=44m2LHT5DLc … #feelthebern #Bernie #BernieSanders #BernieSanders2020 #Sanders2020 #Notmeus #NoMiddleGround",,,#feelthebern #Bernie #BernieSanders #BernieSanders2020 #Sanders2020 #Notmeus #NoMiddleGround,1181356445025132544,https://twitter.com/Howdyhorde/status/1181356445025132544
2019-10-07 23:51:38,SupGirl,shaunking,3,0,8,"Bernie Sanders makes me emotional. He’s never wavered in his what he stands for. I love him so much. #Bernie2020 @SenSanders @BernieSanders https://twitter.com/shaunking/status/1180107147906027525 …",,@SenSanders @BernieSanders,#Bernie2020,1181356441036181504,https://twitter.com/SupGirl/status/1181356441036181504
2019-10-07 23:51:02,blackcrows15,EsotericExposal,1,1,1,"https://youtu.be/TS1GC2kX9HY . Check that video out, it calls out Obama, Pope, Bernie Sanders, a few more. Epstein is tied to all of them.",,,,1181356288170590208,https://twitter.com/blackcrows15/status/1181356288170590208
2019-10-07 23:50:58,Zelpin3,,0,0,0,"YESSS Bernie Sanders &#039;Acing the Electability Test&#039; as Another Poll Shows Senator Crushing Trump in General https://www.commondreams.org/news/2019/08/12/bernie-sanders-acing-electability-test-another-poll-shows-senator-crushing-trump … via @commondreams",,@commondreams,#039 #039,1181356270911131648,https://twitter.com/Zelpin3/status/1181356270911131648
2019-10-07 23:50:34,kozad86,BlueSteelDC,0,0,2,"if Bernie had AOC on his campaign, they probably would have live-streamed the damn thing on Instagram. Ugh. The cult of personality around Bernie Sanders disturbs me deeply. It's no different than what goes on with Trumpers.",,,,1181356173431173120,https://twitter.com/kozad86/status/1181356173431173120
2019-10-07 23:50:29,TheGoddessInari,nicolesandler,1,0,3,"You call yourself a progressive voice through your promotion and advertising, but you yourself call Sanders supporters aggressive and toxic while simultaneously losing it whole saying you support him? Do you see the irony (without blocking) here? #NotMeUs #Bernie2020",,,#NotMeUs #Bernie2020,1181356149242642433,https://twitter.com/TheGoddessInari/status/1181356149242642433
2019-10-07 23:50:28,DROC2447,Yang2020_GBR,1,0,1,"since you have been respectful to discuss with and not hurling insults, absolutely. To be honest, the only way Sanders or Yang could win is by progressives coming together to defeat the Centrists Dems and Republicans.",,,,1181356147401474049,https://twitter.com/DROC2447/status/1181356147401474049
2019-10-07 23:50:20,AlisaRach,,0,0,0,"Bernie Sanders should talk to Adam Schiff about his diet.",,,,1181356114836955136,https://twitter.com/AlisaRach/status/1181356114836955136
2019-10-07 23:50:16,siegelsnest5858,jakemiller85,1,0,0,"If you think that by calling a country socialist it means they have the same plans as Bernie Sanders that doesn’t make any sense. We’re a mixed economy and Bernie knows that. Venezuelan government is totally different.",,,,1181356095522168834,https://twitter.com/siegelsnest5858/status/1181356095522168834
2019-10-07 23:49:34,agntenglnd,texastammers,0,0,2,"He’s repulsed by Bernie Sanders, an actual living artifact from the dawn of creation. Bernie’s just not strong enough.",,,,1181355919965208577,https://twitter.com/agntenglnd/status/1181355919965208577
2019-10-07 23:49:19,LeftOfStalin,,1,0,1,"The only issue I totally trust Elizabeth Warren on is reigning in Wall St. which is more than I can say about almost every other candidate. But the only candidate I trust on nearly every issue is Bernie Sanders, Wall St. included. Warren is a risk progressives can't afford.",,,,1181355855058477063,https://twitter.com/LeftOfStalin/status/1181355855058477063
2019-10-07 23:49:11,thegrandheart,RobSchneider,2,0,0,"All that's good about Warren is what she copied from Bernie Sanders! The only one who would beat Trump and beat him hard is Bernie! Had he been the candidate in 2016 he would be potus already!",,,,1181355821936054278,https://twitter.com/thegrandheart/status/1181355821936054278
2019-10-07 23:48:59,DDale13,,0,0,0,"Hey @washingtonpost, Bernie Sanders was rude to me at a Denny's in Des Moines. Can I write a column for you guys now?",,@washingtonpost,,1181355774968258560,https://twitter.com/DDale13/status/1181355774968258560
2019-10-07 23:48:22,Navy_Chick_,AlexGangitano,1,0,2,"Poor babies... cant buy their influence with Sanders...",,,,1181355618076184578,https://twitter.com/Navy_Chick_/status/1181355618076184578
2019-10-07 23:48:18,EllisDeanHovey,,0,0,0,"Even from home while recovering from heart surgery, Bernie Sanders takes aim at the DNC with his new anti-corruption plan https://www.vox.com/2019/10/7/20902631/bernie-sanders-dnc-anti-corruption-plan?utm_campaign=vox&utm_content=entry&utm_medium=social&utm_source=twitter … via @voxdotcom",,@voxdotcom,,1181355600799625218,https://twitter.com/EllisDeanHovey/status/1181355600799625218
2019-10-07 23:47:58,condomfax,,0,0,0,"whats bernie sanders favorite death grips album",,,,1181355517270085632,https://twitter.com/condomfax/status/1181355517270085632
2019-10-07 23:47:55,Bodhi66,,0,0,1,"Bernie Sanders IS NOT a Democrat!!!!!",,,,1181355504771174401,https://twitter.com/Bodhi66/status/1181355504771174401
2019-10-07 23:47:35,dantsells,,0,0,0,"Woman to Bernie Sanders: My Family Fled Soviet Russia, Socialism Has Failed In Nearly Every Country https://www.realclearpolitics.com/video/2019/04/22/student_to_bernie_sanders_my_family_fled_soviet_russia_socialism_has_failed_in_nearly_every_country.html?fbclid=IwAR2dZlXpzx0GivnLEXbLRfKQZkhkg2HwKAGrPrFq0YM2cCyngXz7ofdqexY …",,,,1181355421543600128,https://twitter.com/dantsells/status/1181355421543600128
2019-10-07 23:47:23,JWKeady,,0,4,18,"Lobbyists pan Sanders proposal to end corporate donations for party conventions | TheHill That corporate lobbyists are against this should tell you everything you need to know. This is why we need @BernieSanders as our nominee and president. https://thehill.com/business-a-lobbying/464720-lobbyists-pan-sanders-proposal-to-end-corporate-donations-for-party-conventions …",,@BernieSanders,,1181355368800309249,https://twitter.com/JWKeady/status/1181355368800309249
2019-10-07 23:47:22,RogerTh57577670,,0,0,0,"If Bernie Sanders is the nominee, he'll ban corporate donations at 2020 Democratic Convention in Milwaukee https://www.jsonline.com/story/news/politics/elections/2019/10/07/dnc-bernie-sanders-would-ban-corporate-donations-2020-convention/3894709002/ … via @journalsentinel",,@journalsentinel,,1181355364253495296,https://twitter.com/RogerTh57577670/status/1181355364253495296
2019-10-07 23:47:18,MarkFromWI,billeniumbeach,0,0,1,"AND now is doing the SAME when fewer eyes are watching!!! #ElizabethIsNoBernie... #NoOneElseButBernie #Bernie #BernieSanders2020 @BernieSanders #BernieSanders #Bernie2020https://twitter.com/billeniumbeach/status/745808748820652032 …",,@BernieSanders,#ElizabethIsNoBernie #NoOneElseButBernie #Bernie #BernieSanders2020 #BernieSanders #Bernie2020https,1181355347807744002,https://twitter.com/MarkFromWI/status/1181355347807744002
2019-10-07 23:47:06,flowerurinals,iggdawg,1,0,0,"The ONLY one who will successfully change the USA's reputation worldwide, is President Bernie Sanders. Get your heads out of your arseholes and make it happen - ffs! https://twitter.com/iggdawg/status/1181305895411691522 …",,,,1181355298801491969,https://twitter.com/flowerurinals/status/1181355298801491969
2019-10-07 23:47:00,siegelsnest5858,jakemiller85,2,0,2,"Venezuela is absolutely not the Bernie Sanders government model lol",,,,1181355273304395777,https://twitter.com/siegelsnest5858/status/1181355273304395777
2019-10-07 23:46:57,VikingInFL,,0,0,0,"Billionaire CEOs Whine on Fox News About Bernie Sanders’ Wealth Tax https://youtu.be/Do7I6ylWMc0 via @YouTube",,@YouTube,,1181355262504034305,https://twitter.com/VikingInFL/status/1181355262504034305
2019-10-07 23:46:19,RichardHayber1,,0,0,1,"Brilliant Bernie Sanders Ad Exposes Gross Media Bias https://youtu.be/ApGHzpGgSN8 via @YouTube",,@YouTube,,1181355103753822209,https://twitter.com/RichardHayber1/status/1181355103753822209
2019-10-07 23:46:15,pana,,0,0,0,"TRUE! Go Bernie. 'Money Is Not Speech and Corporations Are Not People': Sanders Unveils Plan to Get Corporate Money Out of Politics - https://go.shr.lc/31UIemG",,,,1181355085353250816,https://twitter.com/pana/status/1181355085353250816
2019-10-07 23:45:50,DeltheaSimmons,,0,0,1,"The media bias against Bernie Sanders. Watch it if you dare and feel free to share. https://www.youtube.com/watch?v=3ZhkKATtqtU&feature=share …",,,,1181354980189593600,https://twitter.com/DeltheaSimmons/status/1181354980189593600
2019-10-07 23:45:48,PamMaccabee,,1,16,21,"@BernieSanders is the right human for NOW. If we do not elect him president, corporations, Wall St, oligarchs, etc. will rule by ""owning"" our politicians. Bernie Sanders takes aim at the DNC with his new anti-corruption plan https://www.vox.com/2019/10/7/20902631/bernie-sanders-dnc-anti-corruption-plan …",,@BernieSanders,,1181354973457723393,https://twitter.com/PamMaccabee/status/1181354973457723393
2019-10-07 23:45:00,CBS21NEWS,,0,1,1,"WATCH: Democratic presidential candidate Bernie Sanders spoke to reporters while going for a walk in the rain outside his home in Burlington, VT on Monday. Doctors said Sanders had a heart attack and two stents inserted last week. pic.twitter.com/K5KCnatgda",,,,1181354769597775872,https://twitter.com/CBS21NEWS/status/1181354769597775872
2019-10-07 23:44:44,SandySteubing,,0,0,0,"If Bernie Sanders is the nominee, he'll ban corporate donations at 2020 Democratic Convention in Milwaukee https://www.jsonline.com/story/news/politics/elections/2019/10/07/dnc-bernie-sanders-would-ban-corporate-donations-2020-convention/3894709002/ … via @journalsentinel",,@journalsentinel,,1181354703050948618,https://twitter.com/SandySteubing/status/1181354703050948618
2019-10-07 23:44:31,Doug_Hardy,thehill,2,0,1,"Bernie Sanders will win. #BernieBeatsTrump",,,#BernieBeatsTrump,1181354647761539073,https://twitter.com/Doug_Hardy/status/1181354647761539073
2019-10-07 23:44:20,312shelly3,,0,0,2,"A Bernie Sanders Fan Reveals Something Important about The Daily Show | National Review ⁦ @Trevornoah⁩ ⁦ @TheDailyShow⁩ #Bernie2020 #NotMeUshttps://www.nationalreview.com/corner/a-bernie-sanders-fan-reveals-something-important-about-the-daily-show/ …",,@Trevornoah @TheDailyShow,#Bernie2020 #NotMeUshttps,1181354602224111616,https://twitter.com/312shelly3/status/1181354602224111616
2019-10-07 23:44:17,Elli21486,,0,0,0,"This is such a powerful ad for the Bernie Sanders campaign... and it was done by a fan. https://www.youtube.com/watch?v=3ZhkKATtqtU …https://www.youtube.com/watch?v=3ZhkKATtqtU …",,,,1181354589464993792,https://twitter.com/Elli21486/status/1181354589464993792
2019-10-07 23:44:07,ArrogantNBlack,fshakir,13,27,79,"Why is Bernie Sanders allowed to make the rules? Let’s make our own: •Candidates aren’t allowed to take money from dark money PACs such as @OurRevolution •No candidates over 70 years •No candidates with heart attacks •No transfers of funds from prior raceshttps://twitter.com/fshakir/status/1181176539213418497 …",,@OurRevolution,,1181354549380026374,https://twitter.com/ArrogantNBlack/status/1181354549380026374
2019-10-07 23:44:00,FordFischer,SatansJacuzzi,5,2,9,"Bernie Sanders tells @GrimKim he is unclear on whether sex work should be a criminal act, and wants to hear from ""all sides"" to help him think about it. What do you think?https://twitter.com/SatansJacuzzi/status/1181329521997471744 …",,@GrimKim,,1181354520296775680,https://twitter.com/FordFischer/status/1181354520296775680
2019-10-07 23:43:59,lorifire629,ProgressVoice,0,0,0,"NOT Bernie Sanders",,,,1181354513803796480,https://twitter.com/lorifire629/status/1181354513803796480
2019-10-07 23:43:40,Iphagenia,,0,3,5,"""Bernie Sanders is building an unprecedented grassroots campaign to end corruption, and as a nominee would host a grassroots conventions for delegates, party members, teachers, workers, nurses, farmers, and students - corporate lobbyists will never buy influence with Bernie,"" pic.twitter.com/lNMviUCJ9y",,,,1181354434233868293,https://twitter.com/Iphagenia/status/1181354434233868293
2019-10-07 23:43:29,calvinwburford,,0,0,0,"Bernie Sanders speaks for first time after heart attack https://www.cnn.com/videos/politics/2019/10/07/bernie-sanders-walk-heart-attack-sot-vpx-nr.cnn …",,,,1181354387702272000,https://twitter.com/calvinwburford/status/1181354387702272000
2019-10-07 23:43:27,LeftyPuppetMan,LeftyPuppetMan,3,0,0,"Here's a little secret about politics: beliefs are always changing. This is why this idea that Bernie Sanders has NEVER changed his beliefs is kind of weird, IMO.",,,,1181354379980476418,https://twitter.com/LeftyPuppetMan/status/1181354379980476418
2019-10-07 23:43:25,AlligatorSleepy,,0,1,1,"Impeachment Fallout: DNC Attempts to Keep Joe Biden Alive, Sink Bernie Sanders https://ahtribune.com/us/2020-election/3546-dnc-attempts-to-keep-joe-biden-alive.html?fbclid=IwAR2rAikf65IMos0U9uNhjDo-YC3xwkFYJhBzI09P0MMzmWezFsKXlj6rHaE …",,,,1181354372166557696,https://twitter.com/AlligatorSleepy/status/1181354372166557696
2019-10-07 23:42:53,Kizaru,TheBernReport,0,0,1,"Let the Powerful Bernie Sanders Ad Games begin! https://twitter.com/TheBernReport/status/1181232521142386689 …",,,,1181354236287696897,https://twitter.com/Kizaru/status/1181354236287696897
2019-10-07 23:42:50,md_ruben,WoobieTuesday,0,0,0,"Jane Sanders is a saint.",,,,1181354226791911424,https://twitter.com/md_ruben/status/1181354226791911424
2019-10-07 23:42:45,ThomB01,HewlettCraphard,1,0,0,"If you contributed, unless you're an American you and Sanders' campaign violated the law.",,,,1181354204079763456,https://twitter.com/ThomB01/status/1181354204079763456
2019-10-07 23:42:34,deepstatedes,Justin_Ling,0,0,3,"Singh is having a pretty good debate but yeah, this is getting annoying. Reminds me of Bernie Sanders, where, no matter the issue, from racism to abortion, he must pivot back to the evils of the 1%. Society is more complex than that. #Leadersdebate2019 #cdnpoli #elx43https://twitter.com/Justin_Ling/status/1181351969627267072 …",,,#Leadersdebate2019 #cdnpoli #elx43https,1181354158391267333,https://twitter.com/deepstatedes/status/1181354158391267333
2019-10-07 23:42:34,ThomB01,MiladBarzani4,0,0,0,"If you contributed, unless you're an American you and Sanders' campaign violated the law.",,,,1181354157703401472,https://twitter.com/ThomB01/status/1181354157703401472
2019-10-07 23:42:28,RElGENS,,1,0,2,"just cried over bernie sanders what the fuvk",,,,1181354132046786560,https://twitter.com/RElGENS/status/1181354132046786560
2019-10-07 23:42:21,Doug_Hardy,TheBernReport,0,0,2,"Sanders Siblings",,,,1181354104007692288,https://twitter.com/Doug_Hardy/status/1181354104007692288
