date,username,to,replies,retweets,favorites,text,geo,mentions,hashtags,id,permalink
2019-09-11 23:59:34,Formault,,0,0,0,"White liberal neon haired college kids 0.2 seconds before they call me a man for saying that Bernie Sanders is an imperialist pic.twitter.com/8VcKGpxFQf",,,,1171936350397816832,https://twitter.com/Formault/status/1171936350397816832
2019-09-11 23:59:16,DEEJAYEee,,0,0,0,"That’s it I’m a Bernie sanders supporter as of now",,,,1171936277534429184,https://twitter.com/DEEJAYEee/status/1171936277534429184
2019-09-11 23:58:39,don226don,,0,0,0,"Linda Sarsour Endorses Bernie Sanders and Halts Political Progress • Ing... https://youtu.be/aLBmsNItb-Q via @YouTube",,@YouTube,,1171936122391465986,https://twitter.com/don226don/status/1171936122391465986
2019-09-11 23:58:28,Pedro_ChosenOne,BernieSanders,0,0,0,"My most prized treasure valuable possession a Tweet following by Presidental Candidate Senator Bernie Sanders from Vermont. Pedro Smith Author pic.twitter.com/uGg7RAb8me",,,,1171936076442873856,https://twitter.com/Pedro_ChosenOne/status/1171936076442873856
2019-09-11 23:58:17,kearby_brad,TomPerez,0,0,0,"Not the god damn dnc 100 percent behind Bernie Sanders you better not cheat him or the pitchforks will be out",,,,1171936030439739392,https://twitter.com/kearby_brad/status/1171936030439739392
2019-09-11 23:58:14,Scrappy_Scarps,HenryBlue22,1,0,0,"Bernie Sanders",,,,1171936018393640960,https://twitter.com/Scrappy_Scarps/status/1171936018393640960
2019-09-11 23:57:45,WarrenFan4,,7,11,31,"Elizabeth Warren is the only leading candidate who DIDN'T vote for: Mass incarceration (Biden & Sanders) Derivatives deregulation (Biden &amp; Sanders) The Iraq War (Biden) Corporate-written bankruptcy law (Biden) Gunmaker immunity (Sanders) #Biden #Bernie #Warren",,,#Biden #Bernie #Warren,1171935895924170752,https://twitter.com/WarrenFan4/status/1171935895924170752
2019-09-11 23:56:52,pr_barnett,Redtowel4,0,0,4,"Preparation for the Bernie Sanders house parties tomorrow.",,,,1171935671864442880,https://twitter.com/pr_barnett/status/1171935671864442880
2019-09-11 23:56:45,wehrleining,,1,0,1,"fiz um teste de personalidade e deu que minha personalidade é Arquitecto (INTJ). ai fui procurar a lista de pessoas com a mesma personalidade que eu. a lista passou de thanos a voldemort, de bruce wayne a stephen strange e dilma rousseff, de bernie sanders a snape",,,,1171935644676960256,https://twitter.com/wehrleining/status/1171935644676960256
2019-09-11 23:56:32,generationloss,,1,0,1,"One is tulsi Gabbard, who they’re desperately trying to silence at all costs. The other is Bernie Sanders. Tulsi’s stances are incoherent, and Bernie’s are insufficient, but no one else has shown any real interest in breaking from the bipartisan imperialist consensus.",,,,1171935588410376197,https://twitter.com/generationloss/status/1171935588410376197
2019-09-11 23:56:30,baphnedia,samstein,0,0,0,"He's gonna drop more policy releases in one day than Bernie Sanders has in his career?",,,,1171935579056922624,https://twitter.com/baphnedia/status/1171935579056922624
2019-09-11 23:56:10,m_mendozaferrer,CourtneyABC13,0,0,0,"Can you report on Bernie Sanders freely using the ""n-word"" in his 1997 memoir (updated with audio version in 2015) and also including a smear of his former female Rep 96 opponent as ""too brassy. too bitchy. too loud."" She was a rape victim (thread). https://twitter.com/m_mendozaferrer/status/1170573875329077248 …",,,,1171935494411866112,https://twitter.com/m_mendozaferrer/status/1171935494411866112
2019-09-11 23:55:56,StairKeith,kazweida,0,0,0,"Bernie rocks while he rolls. BERNIE SANDERS 2020",,,,1171935437591646213,https://twitter.com/StairKeith/status/1171935437591646213
2019-09-11 23:55:53,drrichardpaul,KatherineMABC13,0,0,6,"Bernie Sanders",,,,1171935424580923392,https://twitter.com/drrichardpaul/status/1171935424580923392
2019-09-11 23:55:36,JPBrunelPhoto,QueenInYeIIow,1,0,2,"Why would she? Her views and policies line up far better with Bernie Sanders...",,,,1171935352006705152,https://twitter.com/JPBrunelPhoto/status/1171935352006705152
2019-09-11 23:55:04,OMA_Project,rondeaulivia,1,0,3,"I'd rather see photoshop picture of you suplexing Bernie Sanders, tbh. But that's probably just me",,,,1171935217843613696,https://twitter.com/OMA_Project/status/1171935217843613696
2019-09-11 23:54:46,m_mendozaferrer,TomPerez,0,3,8,"Can you comment on Bernie Sanders freely using the ""n-word"" in his 1997 memoir (updated with audio version in 2015) and using a smear of his 1996 former female Republican opponent as ""too brassy. too bitchy. too loud."" She was a rape victim (thread). https://twitter.com/m_mendozaferrer/status/1170573875329077248 …",,,,1171935143256346624,https://twitter.com/m_mendozaferrer/status/1171935143256346624
2019-09-11 23:54:41,politicsofhope_,nicolesandler,0,0,1,"Bernie Sanders is the only real electoral threat the power of US financial capital and the global ""war on terror"" currently expanded to 9 countries That's why he's the only candidate",,,,1171935122175791105,https://twitter.com/politicsofhope_/status/1171935122175791105
2019-09-11 23:54:22,YepDemocracy,SusanSarandon,0,0,0,"Has Bernie Sanders read the Mueller Report?",,,,1171935044828459008,https://twitter.com/YepDemocracy/status/1171935044828459008
2019-09-11 23:54:14,DerekPederson3,,0,0,1,"Also: the most under-reported aspect of this is how important educational attainment was in the Democratic primary too. Among non-Hispanic whites, higher levels of educational attainment were strongly correlated with voting for Hillary Clinton over Bernie Sanders. #2016election",,,#2016election,1171935007956447233,https://twitter.com/DerekPederson3/status/1171935007956447233
2019-09-11 23:54:04,PHSJavier,,0,0,0,"Poll: Bernie Sanders Taking the Lead in New Hampshire https://www.breitbart.com/politics/2019/09/11/poll-bernie-sanders-taking-the-lead-in-new-hampshire/?utm_source=dlvr.it&utm_medium=twitter …pic.twitter.com/9yp01kw9Gb",,,,1171934966717898752,https://twitter.com/PHSJavier/status/1171934966717898752
2019-09-11 23:54:03,_NataliePoole_,,0,0,0,"Poll: Bernie Sanders Taking the Lead in New Hampshire https://www.breitbart.com/politics/2019/09/11/poll-bernie-sanders-taking-the-lead-in-new-hampshire/?utm_source=dlvr.it&utm_medium=twitter …pic.twitter.com/W9Ar99zUJR",,,,1171934963958079488,https://twitter.com/_NataliePoole_/status/1171934963958079488
2019-09-11 23:53:47,hardball,,3,4,14,"""If he's going to go after Warren, he's going to get hit by Bernie Sanders."" @JuanitaTolliver on Biden's potential strategies in the debate. #Hardball",,@JuanitaTolliver,#Hardball,1171934895985319936,https://twitter.com/hardball/status/1171934895985319936
2019-09-11 23:53:33,IdiotTracker,,0,0,0,"Warren's campaign reminds me a lot of Bernie Sanders': you listen to the candidate for 5 minutes & think, hey, they've got good ideas and would make a good president. Then you listen to their supporters for 5 minutes & think: I would fight to the death against these creeps.",,,,1171934839286554624,https://twitter.com/IdiotTracker/status/1171934839286554624
2019-09-11 23:53:28,dykcyd,DintMentalFloss,2,0,0,"Said the fragile “Bernie Supporter”, while blocking a longtime Sanders activist. #libruls #delicateflowers #anybluewilldo #WarrenDerangementSyndromepic.twitter.com/oOM4ehfqTW",,,#libruls #delicateflowers #anybluewilldo #WarrenDerangementSyndromepic,1171934816935145473,https://twitter.com/dykcyd/status/1171934816935145473
2019-09-11 23:53:18,Robertlin12,,1,0,0,"Other than that her platform remains the same. She pushed back on Rubin’s “poor” shaming of folks who are stuck in “affordable housing’s Income requirements. Appearing on Dave Rubin is no worse than Bernie Sanders going onto Fox News. I understand she’s also been there",,,,1171934775252148224,https://twitter.com/Robertlin12/status/1171934775252148224
2019-09-11 23:52:58,lilly64,pugsandco,0,0,1,"And Tom Steyer and his idiot ass is right up there with him. He’s Bernie Sanders with money. Just think how useful all that money could be in funding congressional and Senate races, instead of pointless impeachment commercials and now a vanity campaign.",,,,1171934691173294081,https://twitter.com/lilly64/status/1171934691173294081
2019-09-11 23:52:58,ChaunceySprague,KatherineMABC13,0,0,3,"Bernie Sanders!",,,,1171934690497851392,https://twitter.com/ChaunceySprague/status/1171934690497851392
2019-09-11 23:52:51,NoBigGovDuh,,0,0,0,"Bernie Sanders jumps to the lead in NH: Franklin Pierce-Herald poll shows https://www.bostonherald.com/2019/09/11/bernie-sanders-jumps-to-lead-in-nh-franklin-pierce-herald-poll-shows/ … -via Flynx",,,,1171934662891069441,https://twitter.com/NoBigGovDuh/status/1171934662891069441
2019-09-11 23:52:47,ShammySavage,j_duncheon,2,0,3,"This is from the person defending Bernie ""most drug dealers are African American"" Sanders.",,,,1171934646533263365,https://twitter.com/ShammySavage/status/1171934646533263365
2019-09-11 23:52:41,VirginiaShaubel,,0,0,3,"Censored vs. Sinkhole, Transients, Google, Facebook, Bernie Sanders, Oh ... https://youtu.be/sH-TIz56oI8 via @YouTube",,@YouTube,,1171934618087567360,https://twitter.com/VirginiaShaubel/status/1171934618087567360
2019-09-11 23:52:10,blkwomen4bernie,ChazAustin4,1,0,0,"I believe voting matters. I believe being politically engaged matters. When my husband, an Army Veteran, needed help getting his benefits, Bernie Sanders helped us. He used to do a weekly call-in segment on the Thom Hartmann show, he took my call and helped us.",,,,1171934489544519680,https://twitter.com/blkwomen4bernie/status/1171934489544519680
2019-09-11 23:52:01,StairKeith,pinkladyf0xx,0,0,3,"Yes he is the real deal. You just have to love his honesty and knowledge. Bernie is for making our country a better place to live for all. BERNIE SANDERS 2020",,,,1171934453314347014,https://twitter.com/StairKeith/status/1171934453314347014
2019-09-11 23:51:57,PamMaccabee,,0,0,0,"Read Bernie's platform. Nuclear - NOPE. Phase out nuclear power? Elizabeth Warren and Bernie Sanders locked in absurd arms race https://www.usatoday.com/story/opinion/2019/09/11/no-nuclear-power-elizabeth-warren-bernie-sanders-absurd-editorials-debates/2234071001/ … via @usatoday",,@usatoday,,1171934435526230017,https://twitter.com/PamMaccabee/status/1171934435526230017
2019-09-11 23:51:51,TRC288,,0,0,0,"#DiscoInferno Bernie Sanders might have been calling for M4A since 1972, according to Sarandon, but even if true, to this day, any plan he hasn't mentioned yet to make it happen won't happen as long as Republicans remain in the Senate...and Bernie, being a senator, knows this...",,,#DiscoInferno,1171934411719401473,https://twitter.com/TRC288/status/1171934411719401473
2019-09-11 23:51:41,NYCenglessons,h0llyb4xter,0,0,1,"”...here’s a strange thing about Andrew Yang: People who used to vote for Bernie Sanders love him. The alt-right love him. People who have never been interested in politics love him."" NYの遊説で私の隣にいたのはラテン系中学生男子。お母さんを連れてきて雨の中で演説を聞いていました。 https://twitter.com/h0llyb4xter/status/1171904980732829697 …",,,,1171934369260421121,https://twitter.com/NYCenglessons/status/1171934369260421121
2019-09-11 23:50:36,m_mendozaferrer,TheAffinityMag,0,0,0,"Maybe you could report on Bernie Sanders using the ""n-word"" in his 1997 memoir (updated with audio version in 2015) and included a smear of his former female 96 opponent as ""too brassy. too bitchy. too loud."" She was a rape victim (see thread). https://twitter.com/m_mendozaferrer/status/1170573875329077248 …",,,,1171934094491553792,https://twitter.com/m_mendozaferrer/status/1171934094491553792
2019-09-11 23:50:11,cesargarrell,BBCWorld,1,0,1,"His biggest rival is Bernie Sanders.",,,,1171933989537320965,https://twitter.com/cesargarrell/status/1171933989537320965
2019-09-11 23:50:03,NickBarnets,AP,0,0,0,"Important as these are the two strongest (besides Bernie Sanders) Dem candidates so far and represent two very different and competing ways the Democrats can move forward. The centrist vs. center-left, progressive way https://twitter.com/AP/status/1171931922194477056 …",,,,1171933955781791744,https://twitter.com/NickBarnets/status/1171933955781791744
2019-09-11 23:49:27,m_mendozaferrer,TheDemocrats,0,1,2,"I'll watch to see if they ask Bernie Sanders about using the ""n-word"" in his 1997 memoir (updated with audio version in 2015) and included a smear of his former female 96 opponent as ""too brassy. too bitchy. too loud."" She was a rape victim. (thread). https://twitter.com/m_mendozaferrer/status/1170573875329077248 …",,,,1171933806603001856,https://twitter.com/m_mendozaferrer/status/1171933806603001856
2019-09-11 23:49:21,krishna_avi,,1,1,2,"Bernie Sanders turns 78 today, so let’s talk about how age impacts how voters choose a candidate: According to Gallup, only 63% of Americans would vote for a candidate over 70, which is surprisingly less than the number people who vote for someone under of the age 40 (71%).",,,,1171933781403430912,https://twitter.com/krishna_avi/status/1171933781403430912
2019-09-11 23:48:48,Botts1Paul,MSNBC,1,1,4,"He has absolutely no chance to get the nomination he’s a distraction that the front runners do not need. The eventual nominee which will be either Bernie Sanders or Elizabeth Warren needs to be preparing for the general election not the distraction of a prolonged primary season.",,,,1171933644144832512,https://twitter.com/Botts1Paul/status/1171933644144832512
2019-09-11 23:48:43,krishna_avi,,0,0,1,"Bernie Sanders turns 78 today, so let’s talk about how age impacts how voters choose a candidate: according to Gallup, only 63% of Americans would vote for a candidate over 70, which is surprisingly less than the number people who vote for someone under of the age 40 (71%).",,,,1171933622544158720,https://twitter.com/krishna_avi/status/1171933622544158720
2019-09-11 23:48:25,beautou,BernieSanders,0,0,0,"BS gave us Trump in 2016 and he is trying to do it in 202-! Bernie Sanders Will Never be President!",,,,1171933545864019975,https://twitter.com/beautou/status/1171933545864019975
2019-09-11 23:47:55,MaeveSheehey,,0,5,14,"Tar Heels are preparing to Feel the Bern... yes, Bernie Sanders is coming to UNC for a rally in September. https://www.dailytarheel.com/article/2019/09/bernie-sanders-unc-0911 …",,,,1171933420299149313,https://twitter.com/MaeveSheehey/status/1171933420299149313
2019-09-11 23:46:57,gboi480,novenator,1,0,0,"Spin all the fact you want, people can not deny the fact that Bernie Sanders waited 30 plus years to enact his so called ""political revolution"" bs. Who knows maybe there won't be any ""corporate Dems"" if he had done something about it back in 1991.",,,,1171933176928690176,https://twitter.com/gboi480/status/1171933176928690176
2019-09-11 23:46:53,Fibby1123,Crowl3y6,0,0,1,"It’s okay to let people not like Bernie Sanders. Especially people like David Duke. You don’t have to defend your dude to EVERYONE.",,,,1171933161950859264,https://twitter.com/Fibby1123/status/1171933161950859264
2019-09-11 23:46:44,StairKeith,JonStall2009,1,3,22,"Bernie is the real deal. BERNIE SANDERS 2020",,,,1171933124386873346,https://twitter.com/StairKeith/status/1171933124386873346
2019-09-11 23:45:58,Spaniard699,ABCPolitics,0,0,1,"Even though I'm a conservative ( I would not have voted for Trump), I would definitely like to see Bernie Sanders win the next election with a majority. https://twitter.com/ABCPolitics/status/1171910817354326016 …",,,,1171932931150868480,https://twitter.com/Spaniard699/status/1171932931150868480
2019-09-11 23:45:58,dtdexter,,0,0,0,"I am for Bernie Sanders. https://www.facebook.com/1228073029/posts/10220843180289142/ …",,,,1171932927921278976,https://twitter.com/dtdexter/status/1171932927921278976
2019-09-11 23:45:53,FakeTrumpBot1,,0,0,0,"Women are the greatest threat in Florida to the economy. Crazy Bernie Sanders claims loser ""climate change"" is worse.",,,,1171932909432913920,https://twitter.com/FakeTrumpBot1/status/1171932909432913920
2019-09-11 23:45:53,Fibby1123,,0,0,0,"Dedicated Bernie Sanders fan won’t allow anyone to defame her beloved leader, including David Duke of the KKK. Even Klan leaders must get behind Bernie. https://twitter.com/DrDavidDuke/status/1169451868285743104 …pic.twitter.com/E6bpHGQbDe",,,,1171932909235687424,https://twitter.com/Fibby1123/status/1171932909235687424
2019-09-11 23:45:50,dodgrfan1111,,0,0,0,"Deeply Moving Message from Bernie Sanders https://youtu.be/XSRUmRYrRLY via @YouTube",,@YouTube,,1171932897948909568,https://twitter.com/dodgrfan1111/status/1171932897948909568
2019-09-11 23:45:49,Brandon_Lyddon,glenn_ken,1,0,0,"No. America's stupid, archaic electoral college electoral system and voter manipulation by foreign nations allowed trump to win. The Democrats also shot themselves in the foot by giving Clinton the nomination instead of Bernie Sanders who would of beaten Trump.",,,,1171932891728744448,https://twitter.com/Brandon_Lyddon/status/1171932891728744448
2019-09-11 23:45:23,pr_barnett,BernieSanders,0,4,4,"And read his essay... together, comrads. Bernie Sanders’ 1972 Essay on Rape ""Bernie Sanders' presidential campaign tried to distance him from a 1972 essay in which he wrote that a woman ""fantasizes being raped by three men simultaneously."" https://www.snopes.com/fact-check/bernie-sanders-essay …https://twitter.com/BernieSanders/status/1171929982328823808 …",,,,1171932783171837952,https://twitter.com/pr_barnett/status/1171932783171837952
2019-09-11 23:45:16,m_mendozaferrer,kerrywashington,0,0,0,"Would be nice if they asked Bernie Sanders about freely using the ""n-word"" in his 1997 memoir (updated with audio version in 2015) and included a smear of his former female 96 opponent as ""too brassy. too bitchy. too loud."" She was a rape victim (thread). https://twitter.com/m_mendozaferrer/status/1170573875329077248 …",,,,1171932752670855168,https://twitter.com/m_mendozaferrer/status/1171932752670855168
2019-09-11 23:45:14,pr_barnett,BernieSanders,1,1,1,"And read his essay... together, comrads. Bernie Sanders’ 1972 Essay on Rape ""Bernie Sanders' presidential campaign tried to distance him from a 1972 essay in which he wrote that a woman ""fantasizes being raped by three men simultaneously."" https://www.snopes.com/fact-check/bernie-sanders-essay …",,,,1171932744982695936,https://twitter.com/pr_barnett/status/1171932744982695936
2019-09-11 23:45:06,amborin,PollyTickal,0,0,0,"Forget @JoeBiden. New poll shows @SenSanders ahead of all other candidates in New Hampshire: ""Poll: Sanders leads Biden, Warren in New Hampshire"" By HOLLY OTTERBEIN 09/11/2019 05:47 PM EDT https://www.politico.com/story/2019/09/11/sanders-poll-leads-new-hampshire-1491025 …https://twitter.com/PollyTickal/status/1171927426118512640 …",,@JoeBiden @SenSanders,,1171932713051250689,https://twitter.com/amborin/status/1171932713051250689
2019-09-11 23:44:48,kevinmeyerson,,0,0,0,"“He doesn’t know what the fuck TikTok is...but he sure knows the issues they’re facing.” Bernie Sanders’s Enduring Appeal to the Youth Vote in Iowa | The New Yorker https://www.newyorker.com/news/campaign-chronicles/bernie-sanders-enduring-appeal-to-the-youth-vote-in-iowa …",,,,1171932637528674304,https://twitter.com/kevinmeyerson/status/1171932637528674304
2019-09-11 23:44:24,ZaidJilani,MattGrossmann,6,3,6,"These are really bad ratings for Democrats but the most surprising is Bernie Sanders https://mobile.twitter.com/MattGrossmann/status/1171923230254411777 …",,,,1171932535309373442,https://twitter.com/ZaidJilani/status/1171932535309373442
2019-09-11 23:44:16,DennisRuiz_1,,0,0,0,"Senator Bernie Sanders Answers Pressing Questions Regarding His Age, Healthcare, And More http://www.youtube.com/watch?v=jjTmmLlzUP8 …https://lifebalancenow.net/index.php/2019/09/11/senator-bernie-sanders-answers-pressing-questions-regarding-his-age-healthcare-and-more/ …",,,,1171932500337266688,https://twitter.com/DennisRuiz_1/status/1171932500337266688
2019-09-11 23:44:15,lifebalancenow1,,0,0,0,"Senator Bernie Sanders Answers Pressing Questions Regarding His Age, Healthcare, And More http://www.youtube.com/watch?v=jjTmmLlzUP8 … https://lifebalancenow.net/index.php/2019/09/11/senator-bernie-sanders-answers-pressing-questions-regarding-his-age-healthcare-and-more/ …",,,,1171932496847654913,https://twitter.com/lifebalancenow1/status/1171932496847654913
2019-09-11 23:43:52,addikitti,,2,0,20,"So, therapist asked my pronouns, is atheist, and is a liberal who supports Bernie Sanders. She's easy to talk to so far, and she has a different background than most therapists. I lucked out. I think we'll get along swimmingly.",,,,1171932403029270529,https://twitter.com/addikitti/status/1171932403029270529
2019-09-11 23:43:46,JonathanCohn,,7,4,43,"Bernie Sanders is definitely the most progressive on Latin America policy, which is why it's still disappointing to me that, unlike Warren, Booker, and Harris, he voted to confirm Kelly as DHS Secretary.",,,,1171932377167421440,https://twitter.com/JonathanCohn/status/1171932377167421440
2019-09-11 23:43:43,joshfoxfilm,,0,19,42,"On 18th Anniversary of 9/11, Bernie Sanders Calls for End to Endless War https://www.commondreams.org/news/2019/09/11/18th-anniversary-911-bernie-sanders-calls-end-endless-war …",,,,1171932364395679744,https://twitter.com/joshfoxfilm/status/1171932364395679744
2019-09-11 23:43:34,noticiasjaps2,,0,0,0,"Poll: Bernie Sanders Taking the Lead in New Hampshire https://www.breitbart.com/politics/2019/09/11/poll-bernie-sanders-taking-the-lead-in-new-hampshire/?utm_source=dlvr.it&utm_medium=twitter …pic.twitter.com/tc2lhDWOnM",,,,1171932326370013184,https://twitter.com/noticiasjaps2/status/1171932326370013184
2019-09-11 23:43:25,ReneDugas1,MarkMarkegv1,1,0,0,"Who is deciding what is fair? Sounds like a Bernie Sanders quote. Is this plagiarism?",,,,1171932289661657088,https://twitter.com/ReneDugas1/status/1171932289661657088
2019-09-11 23:42:41,People4Bernie,SteveBradford,2,44,132,"Not a single California State Senator voted against college athletes/workers, LeBron James, and Bernie Sanders. #sb206https://twitter.com/SteveBradford/status/1171928510954270720 …",,,#sb206https,1171932105183354882,https://twitter.com/People4Bernie/status/1171932105183354882
2019-09-11 23:42:39,azathioprene,,0,0,1,"I’m not one for politics but that last Bernie Sanders tweet I retweeted is pretty solid",,,,1171932096367140876,https://twitter.com/azathioprene/status/1171932096367140876
2019-09-11 23:42:35,sylviaulloa,realMikeAguilar,1,0,0,"Sanders is 78 yrs old. I think maybe his kids have graduated already.",,,,1171932079736537088,https://twitter.com/sylviaulloa/status/1171932079736537088
2019-09-11 23:42:33,adamjayarr,agraybee,2,0,8,"the campaign made a ""Bernie Sanders Field of Dreams"" t-shirt (available on his website for only $27!) for his stop in Iowa. This is him wearing it and showing off his youthful vigor. pic.twitter.com/5sFLOtDHFm",,,,1171932067770191872,https://twitter.com/adamjayarr/status/1171932067770191872
2019-09-11 23:41:55,RachelBfromLES,,0,0,0,"Bernie Sanders jumps to the lead in NH: Franklin Pierce-Herald poll shows https://www.bostonherald.com/2019/09/11/bernie-sanders-jumps-to-lead-in-nh-franklin-pierce-herald-poll-shows/ …",,,,1171931910077124608,https://twitter.com/RachelBfromLES/status/1171931910077124608
2019-09-11 23:41:44,JustinLeeper_yo,FairlyLip,1,0,0,"Then trash Biden. Trash Trump. I’m seriously tired of people thinking that supporting Sanders also means ripping Warren. I like em both, but some Bernie supporters are not helping his image with this negativity.",,,,1171931862467411970,https://twitter.com/JustinLeeper_yo/status/1171931862467411970
2019-09-11 23:41:00,Pro_Christo_Gov,BernieSanders,0,0,0,"The Council supports officially Senator Bernie Sanders. Join : PRO CHRISTO GOV https://twitter.com/BernieSanders/status/1171922757896101890 …",,,,1171931679918891013,https://twitter.com/Pro_Christo_Gov/status/1171931679918891013
2019-09-11 23:40:59,amaloif_m,BernieSanders,0,0,0,"Homeless Crisis in Cities like California, Oregon and other Liberal/Progressive Socialist run Cities is what a Bernie Sanders Socialist Country will look like. Free isn’t Free it’s a Lie and those who believe the lie are ‘Sheep being lead to slaughter be the Totalitarianism Myth pic.twitter.com/HftcN0A8rL",,,,1171931675305160704,https://twitter.com/amaloif_m/status/1171931675305160704
2019-09-11 23:40:57,AmirAminiMD,millstreet22,30,374,1211,"This isn’t a Bernie rally. This is the Democratic New Hampshire convention transformed into a Bernie rally. There’s no doubt in my mind that Bernie Sanders is the ONLY candidate able to generate the enthusiasm & determination needed to beat Donald Trump. https://twitter.com/millstreet22/status/1170398173065601028?s=21 …",,,,1171931667579191297,https://twitter.com/AmirAminiMD/status/1171931667579191297
2019-09-11 23:40:17,LilLubbie,Serremmy,0,0,0,"Aren’t you glad Bernie Sanders picked this woman to be his surrogate?? Comments Senator??? @SenSanders",,@SenSanders,,1171931500297838592,https://twitter.com/LilLubbie/status/1171931500297838592
2019-09-11 23:39:22,grbgeman101,BernieSanders,0,0,0,"Thank go BERNIE SANDERS wasn't the President, and Bill deblasio Wasn't the Mayor of NYC at the time",,,,1171931267362959360,https://twitter.com/grbgeman101/status/1171931267362959360
2019-09-11 23:39:12,wack_worm,,2,0,21,"me and bernie sanders are the only jews in vermont",,,,1171931225809936385,https://twitter.com/wack_worm/status/1171931225809936385
