date,username,to,replies,retweets,favorites,text,geo,mentions,hashtags,id,permalink
2019-10-07 23:42:04,SDLRacing,Liz_Wheeler,0,0,0,"Hey Liz, hunting season just began here in PA and it don't include guns this weekLittle Red Dots Do Wonders For Idiots Like KFC SANDERS WANTA BE COMMIE BERNIE https://twitter.com/Liz_Wheeler/status/1181284977222176770 …",,,,1181354034453762051,https://twitter.com/SDLRacing/status/1181354034453762051
2019-10-07 23:41:37,mediumvillain,,1,3,15,"The best part about it will be that the same liberals who suddenly ~forget~ how bad Trump was will still have some passionate hatred of Bernie Sanders for some shit they blame him for that he never even did",,,,1181353917550075904,https://twitter.com/mediumvillain/status/1181353917550075904
2019-10-07 23:41:28,sal636,ladycowparsley,2,3,21,"Concern trolling about Bernie's Sanders ability to be president while Trump is currently the president is a bad look. Do you really think that Sanders can't do the job, an idiot is currently doing it. GTFOH with that.",,,,1181353883173605376,https://twitter.com/sal636/status/1181353883173605376
2019-10-07 23:41:23,mixelplith13,McDonaldsCorp,0,0,0,"@McDonaldsCorp Billionaire CEOs Whine on Fox News About Bernie Sanders’ Wealth Tax #CrySomeMoreClown http://youtu.be/Do7I6ylWMc0 via @YouTube",,@McDonaldsCorp @YouTube,#CrySomeMoreClown,1181353860251697152,https://twitter.com/mixelplith13/status/1181353860251697152
2019-10-07 23:40:57,seeunitro,,0,0,2,"when you scrollin on IG and you hear bernie sanders say ""hi""",,,,1181353751778676736,https://twitter.com/seeunitro/status/1181353751778676736
2019-10-07 23:40:46,slimjadeyxoxo2,,1,0,2,"BERNIE SANDERS HAD A STROKE",,,,1181353703271469057,https://twitter.com/slimjadeyxoxo2/status/1181353703271469057
2019-10-07 23:40:41,mixelplith13,,0,0,0,"@McDonaldsCorp Billionaire CEOs Whine on Fox News About Bernie Sanders’ Wealth Tax #CrySomeMoreClown https://youtu.be/Do7I6ylWMc0 via @YouTube",,@McDonaldsCorp @YouTube,#CrySomeMoreClown,1181353684573143040,https://twitter.com/mixelplith13/status/1181353684573143040
2019-10-07 23:40:39,ZalmanR1,cookie_vegas,3,0,1,"I just read the article. It says it's an idea that Sanders finds intriguing. Its not an idea he ultimately put in his 2016 campaign or in his 2020 campaign till now. Even now he hasn't specified an amount.",,,,1181353677916782592,https://twitter.com/ZalmanR1/status/1181353677916782592
2019-10-07 23:40:34,Digitalwolff,forevertawl,0,0,1,"I would assume the DNC made him, just like the other 22 running interference on Sanders. pic.twitter.com/wRKZrc0bLD",,,,1181353654290399235,https://twitter.com/Digitalwolff/status/1181353654290399235
2019-10-07 23:40:33,McResistor,MercedesGlobal,0,0,0,"Yup, and he fought the discrimination by taking off his turban to pander to racists and bigots in Quebec. He basically defiled his faith so that he could get more votes in Quebec. That's not leadership. #cdnpoli My right arm for a Bernie Sanders in Canada... https://twitter.com/MercedesGlobal/status/1181352899315675138 …",,,#cdnpoli,1181353649932525575,https://twitter.com/McResistor/status/1181353649932525575
2019-10-07 23:40:32,Briankmcneal,Meemaw570,0,0,0,"And I should take your word for it!? You've clearly got a problem with Bernie Sanders. Physician, cure thyself! pic.twitter.com/lHObqns07T",,,,1181353644840701952,https://twitter.com/Briankmcneal/status/1181353644840701952
2019-10-07 23:40:00,thehill,,15,14,112,"""I feel very good."" Sen. Bernie Sanders goes for a walk with his wife Jane. pic.twitter.com/JvwYwGmZ8B",,,,1181353511222513666,https://twitter.com/thehill/status/1181353511222513666
2019-10-07 23:39:36,You_Shiku,,0,0,1,"Funny how BERNIE SANDERS is a DEM SOC with DUMB SOCKS.",,,,1181353412249735168,https://twitter.com/You_Shiku/status/1181353412249735168
2019-10-07 23:39:25,MantasNick,,0,0,0,"#repost inspired_by_bernie_sanders ・・・ #feelthebern #berniesanders #berniesanders2020 #notmeus #politicalrevolution #bernie #berniesandersforpresident #fightforwhatsright #compassion… https://www.instagram.com/p/B3VfLDsHuBsECPfakMIotAj1zy3aJRO8rMk9As0/?igshid=142ubo7fzcjmb …",,,#repost #feelthebern #berniesanders #berniesanders2020 #notmeus #politicalrevolution #bernie #berniesandersforpresident #fightforwhatsright #compassion,1181353365684576258,https://twitter.com/MantasNick/status/1181353365684576258
2019-10-07 23:39:05,JulesJester,,0,2,4,"Updates from VT w/ @GaryGrumbach & @shaqbrewster → • @BernieSanders went for a walk w/ wife Jane, said he's ""getting back to work a little bit right now"" • Sanders spoke on a staff call, said he's feeling better than he has in a long time + talked thru urgency of this campaign pic.twitter.com/SIk6cZhu8B",,@GaryGrumbach @shaqbrewster @BernieSanders,,1181353281999667200,https://twitter.com/JulesJester/status/1181353281999667200
2019-10-07 23:39:01,RobertoPrusso,,0,0,0,"If Bernie Sanders is the nominee, he'll ban corporate donations at 2020 Democratic Convention in Milwaukee https://www.jsonline.com/story/news/politics/elections/2019/10/07/dnc-bernie-sanders-would-ban-corporate-donations-2020-convention/3894709002/ …",,,,1181353266153549825,https://twitter.com/RobertoPrusso/status/1181353266153549825
2019-10-07 23:38:56,SantosHuante,,0,0,3,"Is Bernie Sanders now Wolf-PAC's ... Top Dog? #tytlive",,,#tytlive,1181353245375176704,https://twitter.com/SantosHuante/status/1181353245375176704
2019-10-07 23:38:22,wolvereneme,BernieSanders,0,0,0,"Why would you want the president to believe in the Constitution Bernie Sanders when you're pushing socialism which is totally against the Constitution",,,,1181353100856250370,https://twitter.com/wolvereneme/status/1181353100856250370
