date,username,to,replies,retweets,favorites,text,geo,mentions,hashtags,id,permalink
2019-08-08 23:45:23,thedirtyweasel,KimNorvellDMR,0,0,2,"“Hey, you’re Elizabeth Warren! You want to buy some of my homemade lemonaid? That’s great! Are you going to raise taxes on my middle class family? You are, huh?Oh, well, I’ll give a special price... 7 dollars... yeah, $7 for a glass of lemon juice, water, and sugar.”",,,,1159611597268160519,https://twitter.com/thedirtyweasel/status/1159611597268160519
2019-08-08 23:45:23,GevatterTod187,ewarren,0,0,0,"Today I was asked if Elizabeth Warren was a pandering, self important, compulsive liar. I said “yes”. pic.twitter.com/breTDzoPLV",,,,1159611594629963776,https://twitter.com/GevatterTod187/status/1159611594629963776
2019-08-08 23:45:04,AM_National,,1,1,1,"""Here’s Why Elizabeth Warren’s Wealth Tax Is Completely Unconstitutional"" https://loom.ly/GzvgRlQ pic.twitter.com/A3a75RJnZ3",,,,1159611513575022593,https://twitter.com/AM_National/status/1159611513575022593
2019-08-08 23:45:01,TreyArcanum,ewarren,0,0,1,"Today I was asked if Elizabeth Warren was a #LyingTraitor and a member of the #deepState #illuminati I said YES. #WalkAwayFromDemocrats #Trump2020",,,#LyingTraitor #deepState #illuminati #WalkAwayFromDemocrats #Trump2020,1159611502845972481,https://twitter.com/TreyArcanum/status/1159611502845972481
2019-08-08 23:45:00,CQnow,,0,1,0,"Elizabeth Warren probes Capital One after massive data breach - via @rollcall @DeanDeChiarohttp://bit.ly/2YUmmp8",,@rollcall @DeanDeChiarohttp,,1159611497586102273,https://twitter.com/CQnow/status/1159611497586102273
2019-08-08 23:44:47,flemking,,0,0,0,"Join me in supporting Elizabeth Warren via @actblue. Did it again because she answered the #WhiteSupremacistInChief question bravely & correctly. I've never even thought about maxing out to a candidate before! @ewarrenhttps://secure.actblue.com/donate/ew-homepage-launch-050919 …",,@actblue @ewarrenhttps,#WhiteSupremacistInChief,1159611446159822849,https://twitter.com/flemking/status/1159611446159822849
2019-08-08 23:44:35,dubes09,ewarren,0,0,0,"Today I was asked if Elizabeth Warren is an Indian, then I was asked if she was a liar, and I said yes!",,,,1159611392472887296,https://twitter.com/dubes09/status/1159611392472887296
2019-08-08 23:44:33,Joeamer52610510,ewarren,0,0,1,"Today I was asked if Elizabeth warren is a American Indian .. I said No!",,,,1159611386193801217,https://twitter.com/Joeamer52610510/status/1159611386193801217
2019-08-08 23:44:13,dailyreadlist,,0,0,0,"Is Donald Trump a White Supremacist? Elizabeth Warren Says “Yes” #entertainmenthttp://bit.ly/2YC95X2",,,#entertainmenthttp,1159611302144331778,https://twitter.com/dailyreadlist/status/1159611302144331778
2019-08-08 23:44:02,UrbanikMarysel,RayAllenInMN,0,0,0,"Get the information right Ohio he was a devotee if Elizabeth Warren and the other one in El Paso Antifa. So sorry for you your low IQ is evident and that makes you pic.twitter.com/rSRRDwjTyW",,,,1159611255923122177,https://twitter.com/UrbanikMarysel/status/1159611255923122177
